begin;
  set local search_path = '';
  -- BASELINE: 0 issues on empty schema
  select * from lint."0030_invalid_index";
 name | title | level | facing | categories | description | detail | remediation | metadata | cache_key 
------+-------+-------+--------+------------+-------------+--------+-------------+----------+-----------
(0 rows)

  savepoint a;
  -- NEGATIVE EXAMPLE: a normal, valid index should NOT trigger
  create table public.orders(
    id int primary key,
    customer_id int
  );
  create index idx_orders_customer_id on public.orders (customer_id);
  select * from lint."0030_invalid_index";  -- expect 0 rows
 name | title | level | facing | categories | description | detail | remediation | metadata | cache_key 
------+-------+-------+--------+------------+-------------+--------+-------------+----------+-----------
(0 rows)

  rollback to savepoint a;
  -- NEGATIVE EXAMPLE: a partitioned parent index created with ON ONLY is
  -- marked invalid by design until every child index is attached; it should
  -- NOT trigger
  create table public.events(id int, ts date) partition by range (ts);
  create table public.events_2026 partition of public.events
    for values from ('2026-01-01') to ('2027-01-01');
  create index idx_events_ts on only public.events (ts);
  select * from lint."0030_invalid_index";  -- expect 0 rows
 name | title | level | facing | categories | description | detail | remediation | metadata | cache_key 
------+-------+-------+--------+------------+-------------+--------+-------------+----------+-----------
(0 rows)

  rollback to savepoint a;
  -- POSITIVE EXAMPLE: an index left invalid (as happens when
  -- CREATE INDEX CONCURRENTLY / REINDEX CONCURRENTLY fails partway through)
  -- Simulated here via direct catalog update since CONCURRENTLY cannot
  -- run inside a transaction block.
  create table public.orders(
    id int primary key,
    order_number int
  );
  create unique index idx_orders_order_number on public.orders (order_number);
  update pg_catalog.pg_index
    set indisvalid = false
    where indexrelid = 'public.idx_orders_order_number'::regclass;
  select name, detail, cache_key from lint."0030_invalid_index";  -- expect 1 row
     name      |                                                                                         detail                                                                                         |                      cache_key                      
---------------+----------------------------------------------------------------------------------------------------------------------------------------------------------------------------------------+-----------------------------------------------------
 invalid_index | Index `idx_orders_order_number` on table `public.orders` is invalid and is not used by the query planner. Rebuild it with `reindex index concurrently public.idx_orders_order_number;` | invalid_index_public_orders_idx_orders_order_number
(1 row)

  -- RESOLUTION: reindex validates the index. The docs recommend
  -- `reindex index concurrently` but CONCURRENTLY cannot run inside a
  -- transaction block, so the test uses the non-concurrent form.
  reindex index public.idx_orders_order_number;
  select * from lint."0030_invalid_index";  -- expect 0 rows
 name | title | level | facing | categories | description | detail | remediation | metadata | cache_key 
------+-------+-------+--------+------------+-------------+--------+-------------+----------+-----------
(0 rows)

  rollback to savepoint a;
  -- POSITIVE EXAMPLE (exception): an invalid index backing an exclusion
  -- constraint cannot be reindexed concurrently, so the message recommends
  -- a non-concurrent reindex instead.
  create table public.reservations(
    id int primary key,
    during int4range,
    constraint reservations_during_excl exclude using gist (during with &&)
  );
  update pg_catalog.pg_index
    set indisvalid = false
    where indexrelid = 'public.reservations_during_excl'::regclass;
  select name, detail, cache_key from lint."0030_invalid_index";  -- expect 1 row
     name      |                                                                                                                                                                                 detail                                                                                                                                                                                 |                         cache_key                          
---------------+------------------------------------------------------------------------------------------------------------------------------------------------------------------------------------------------------------------------------------------------------------------------------------------------------------------------------------------------------------------------+------------------------------------------------------------
 invalid_index | Index `reservations_during_excl` on table `public.reservations` is invalid and is not used by the query planner. It backs an exclusion constraint and cannot be reindexed concurrently. Rebuild it with `reindex index public.reservations_during_excl;`. Note that a non-concurrent reindex blocks writes to the table and may take significant time on large tables. | invalid_index_public_reservations_reservations_during_excl
(1 row)

  -- RESOLUTION: a non-concurrent reindex validates the index
  reindex index public.reservations_during_excl;
  select * from lint."0030_invalid_index";  -- expect 0 rows
 name | title | level | facing | categories | description | detail | remediation | metadata | cache_key 
------+-------+-------+--------+------------+-------------+--------+-------------+----------+-----------
(0 rows)

  rollback to savepoint a;
  -- POSITIVE EXAMPLE: a LEAF partition's index left invalid IS flagged. Only the
  -- partitioned PARENT index (relkind 'I') is excluded; a leaf partition's index
  -- (relkind 'i') is an ordinary index and must still be linted.
  create table public.events(id int, ts date) partition by range (ts);
  create table public.events_2026 partition of public.events
    for values from ('2026-01-01') to ('2027-01-01');
  create index idx_events_2026_ts on public.events_2026 (ts);
  update pg_catalog.pg_index
    set indisvalid = false
    where indexrelid = 'public.idx_events_2026_ts'::regclass;
  select name, detail, cache_key from lint."0030_invalid_index";  -- expect 1 row
     name      |                                                                                      detail                                                                                       |                      cache_key                      
---------------+-----------------------------------------------------------------------------------------------------------------------------------------------------------------------------------+-----------------------------------------------------
 invalid_index | Index `idx_events_2026_ts` on table `public.events_2026` is invalid and is not used by the query planner. Rebuild it with `reindex index concurrently public.idx_events_2026_ts;` | invalid_index_public_events_2026_idx_events_2026_ts
(1 row)

  rollback to savepoint a;
  -- NEGATIVE EXAMPLE: an invalid index in an internal (excluded) schema is NOT
  -- flagged -- the lint only reports customer-facing schemas.
  create schema repack;
  create table repack.t(id int);
  create unique index idx_repack_t_id on repack.t (id);
  update pg_catalog.pg_index
    set indisvalid = false
    where indexrelid = 'repack.idx_repack_t_id'::regclass;
  select * from lint."0030_invalid_index";  -- expect 0 rows
 name | title | level | facing | categories | description | detail | remediation | metadata | cache_key 
------+-------+-------+--------+------------+-------------+--------+-------------+----------+-----------
(0 rows)

rollback;
